{
  "$schema": "https://json-schema.org/draft/2020-12/schema",
  "$id": "https://github.com/plexusone/structured-evaluation/schema/rubric.schema.json",
  "properties": {
    "$schema": {
      "type": "string"
    },
    "schemaVersion": {
      "type": "string"
    },
    "metadata": {
      "properties": {
        "document": {
          "type": "string"
        },
        "documentId": {
          "type": "string"
        },
        "documentTitle": {
          "type": "string"
        },
        "documentVersion": {
          "type": "string"
        },
        "generatedAt": {
          "type": "string",
          "format": "date-time"
        },
        "generatedBy": {
          "type": "string"
        },
        "reviewerId": {
          "type": "string"
        }
      },
      "additionalProperties": false,
      "type": "object"
    },
    "reviewType": {
      "type": "string"
    },
    "judge": {
      "properties": {
        "judge_id": {
          "type": "string"
        },
        "method": {
          "type": "string",
          "enum": [
            "deterministic",
            "semantic",
            "human"
          ],
          "description": "Evaluation method: deterministic (mechanical check), semantic (LLM judgment), or human (human decision)"
        },
        "model": {
          "type": "string"
        },
        "model_provider": {
          "type": "string"
        },
        "model_version": {
          "type": "string"
        },
        "prompt_template": {
          "type": "string"
        },
        "prompt_version": {
          "type": "string"
        },
        "system_prompt": {
          "type": "string"
        },
        "temperature": {
          "type": "number"
        },
        "max_tokens": {
          "type": "integer"
        },
        "check_id": {
          "type": "string"
        },
        "check_version": {
          "type": "string"
        },
        "reviewer_id": {
          "type": "string"
        },
        "reviewer_name": {
          "type": "string"
        },
        "rubric_id": {
          "type": "string"
        },
        "rubric_version": {
          "type": "string"
        },
        "evaluated_at": {
          "type": "string",
          "format": "date-time"
        },
        "latency": {
          "type": "integer"
        },
        "tokens_used": {
          "properties": {
            "input_tokens": {
              "type": "integer"
            },
            "output_tokens": {
              "type": "integer"
            },
            "total_tokens": {
              "type": "integer"
            },
            "cache_read_tokens": {
              "type": "integer"
            },
            "cache_write_tokens": {
              "type": "integer"
            }
          },
          "additionalProperties": false,
          "type": "object"
        },
        "trace_id": {
          "type": "string"
        },
        "span_id": {
          "type": "string"
        }
      },
      "additionalProperties": false,
      "type": "object"
    },
    "rubricId": {
      "type": "string"
    },
    "rubricVersion": {
      "type": "string"
    },
    "reference": {
      "properties": {
        "id": {
          "type": "string"
        },
        "input": {
          "type": "string"
        },
        "expected_output": {
          "type": "string"
        },
        "expected_outputs": {
          "items": {
            "type": "string"
          },
          "type": "array"
        },
        "context": {
          "items": {
            "type": "string"
          },
          "type": "array"
        },
        "annotations": {
          "items": {
            "properties": {
              "name": {
                "type": "string"
              },
              "score": {
                "type": "number"
              },
              "label": {
                "type": "string"
              },
              "explanation": {
                "type": "string"
              },
              "annotator_id": {
                "type": "string"
              },
              "annotator_type": {
                "type": "string"
              }
            },
            "additionalProperties": false,
            "type": "object"
          },
          "type": "array"
        },
        "source": {
          "type": "string"
        },
        "tags": {
          "items": {
            "type": "string"
          },
          "type": "array"
        },
        "metadata": {
          "type": "object"
        }
      },
      "additionalProperties": false,
      "type": "object"
    },
    "intScore": {
      "type": "integer"
    },
    "confidence": {
      "type": "number"
    },
    "pass": {
      "type": "boolean"
    },
    "blocking": {
      "items": {
        "type": "string"
      },
      "type": "array"
    },
    "categories": {
      "items": {
        "properties": {
          "category": {
            "type": "string"
          },
          "score": {
            "type": "string",
            "enum": [
              "pass",
              "partial",
              "fail"
            ],
            "description": "Category score: pass, partial, or fail"
          },
          "intScore": {
            "type": "integer"
          },
          "numericScore": {
            "type": "number"
          },
          "confidence": {
            "type": "number"
          },
          "severity": {
            "type": "string",
            "enum": [
              "critical",
              "high",
              "medium",
              "low",
              "info"
            ],
            "description": "Finding severity: critical, high, medium, low, or info"
          },
          "reasonCodes": {
            "items": {
              "type": "string"
            },
            "type": "array"
          },
          "reasoning": {
            "type": "string"
          },
          "evidence": {
            "items": {
              "type": "string"
            },
            "type": "array"
          },
          "findings": {
            "items": {
              "properties": {
                "id": {
                  "type": "string"
                },
                "category": {
                  "type": "string"
                },
                "code": {
                  "type": "string"
                },
                "severity": {
                  "type": "string",
                  "enum": [
                    "critical",
                    "high",
                    "medium",
                    "low",
                    "info"
                  ],
                  "description": "Finding severity: critical, high, medium, low, or info"
                },
                "title": {
                  "type": "string"
                },
                "description": {
                  "type": "string"
                },
                "recommendation": {
                  "type": "string"
                },
                "location": {
                  "type": "string"
                },
                "evidence": {
                  "type": "string"
                },
                "owner": {
                  "type": "string"
                },
                "effort": {
                  "type": "string"
                }
              },
              "additionalProperties": false,
              "type": "object"
            },
            "type": "array"
          },
          "checklistResults": {
            "properties": {
              "requiredPresent": {
                "items": {
                  "type": "string"
                },
                "type": "array"
              },
              "requiredMissing": {
                "items": {
                  "type": "string"
                },
                "type": "array"
              },
              "optionalPresent": {
                "items": {
                  "type": "string"
                },
                "type": "array"
              },
              "optionalMissing": {
                "items": {
                  "type": "string"
                },
                "type": "array"
              }
            },
            "additionalProperties": false,
            "type": "object"
          }
        },
        "additionalProperties": false,
        "type": "object"
      },
      "type": "array"
    },
    "findings": {
      "items": {
        "properties": {
          "id": {
            "type": "string"
          },
          "category": {
            "type": "string"
          },
          "code": {
            "type": "string"
          },
          "severity": {
            "type": "string",
            "enum": [
              "critical",
              "high",
              "medium",
              "low",
              "info"
            ],
            "description": "Finding severity: critical, high, medium, low, or info"
          },
          "title": {
            "type": "string"
          },
          "description": {
            "type": "string"
          },
          "recommendation": {
            "type": "string"
          },
          "location": {
            "type": "string"
          },
          "evidence": {
            "type": "string"
          },
          "owner": {
            "type": "string"
          },
          "effort": {
            "type": "string"
          }
        },
        "additionalProperties": false,
        "type": "object"
      },
      "type": "array"
    },
    "passCriteria": {
      "properties": {
        "minCategoriesPassing": {
          "type": "string"
        },
        "maxFindingsSeverity": {
          "properties": {
            "critical": {
              "type": "integer"
            },
            "high": {
              "type": "integer"
            },
            "medium": {
              "type": "integer"
            },
            "low": {
              "type": "integer"
            }
          },
          "additionalProperties": false,
          "type": "object"
        },
        "minIntScore": {
          "type": "integer"
        }
      },
      "additionalProperties": false,
      "type": "object"
    },
    "decision": {
      "properties": {
        "status": {
          "type": "string",
          "enum": [
            "pass",
            "conditional",
            "fail",
            "human_review"
          ],
          "description": "Decision status: pass, conditional, fail, or human_review"
        },
        "passed": {
          "type": "boolean"
        },
        "rationale": {
          "type": "string"
        },
        "findingCounts": {
          "properties": {
            "critical": {
              "type": "integer"
            },
            "high": {
              "type": "integer"
            },
            "medium": {
              "type": "integer"
            },
            "low": {
              "type": "integer"
            },
            "info": {
              "type": "integer"
            },
            "total": {
              "type": "integer"
            }
          },
          "additionalProperties": false,
          "type": "object"
        },
        "categoryCounts": {
          "properties": {
            "pass": {
              "type": "integer"
            },
            "partial": {
              "type": "integer"
            },
            "fail": {
              "type": "integer"
            },
            "total": {
              "type": "integer"
            }
          },
          "additionalProperties": false,
          "type": "object"
        }
      },
      "additionalProperties": false,
      "type": "object"
    },
    "overallDecision": {
      "type": "string",
      "enum": [
        "pass",
        "conditional",
        "fail",
        "human_review"
      ],
      "description": "Overall decision status"
    },
    "nextSteps": {
      "properties": {
        "rerunCommand": {
          "type": "string"
        },
        "immediate": {
          "items": {
            "properties": {
              "action": {
                "type": "string"
              },
              "category": {
                "type": "string"
              },
              "severity": {
                "type": "string",
                "enum": [
                  "critical",
                  "high",
                  "medium",
                  "low",
                  "info"
                ],
                "description": "Finding severity: critical, high, medium, low, or info"
              },
              "owner": {
                "type": "string"
              },
              "effort": {
                "type": "string"
              }
            },
            "additionalProperties": false,
            "type": "object"
          },
          "type": "array"
        },
        "recommended": {
          "items": {
            "properties": {
              "action": {
                "type": "string"
              },
              "category": {
                "type": "string"
              },
              "severity": {
                "type": "string",
                "enum": [
                  "critical",
                  "high",
                  "medium",
                  "low",
                  "info"
                ],
                "description": "Finding severity: critical, high, medium, low, or info"
              },
              "owner": {
                "type": "string"
              },
              "effort": {
                "type": "string"
              }
            },
            "additionalProperties": false,
            "type": "object"
          },
          "type": "array"
        }
      },
      "additionalProperties": false,
      "type": "object"
    },
    "summary": {
      "type": "string"
    },
    "extensions": {
      "type": "object"
    }
  },
  "additionalProperties": false,
  "type": "object",
  "title": "Rubric Report",
  "description": "Schema for rubric-based LLM-as-Judge evaluation reports"
}