{
  "schemaVersion": "v2",
  "metadata": {
    "document": "prd.md",
    "generatedAt": "2026-07-20T12:44:17.821101Z",
    "generatedBy": "structured-evaluation"
  },
  "reviewType": "prd",
  "intScore": 5,
  "pass": true,
  "categories": [
    {
      "category": "clarity",
      "score": "pass",
      "intScore": 5,
      "severity": "low",
      "reasoning": "Clear and specific.",
      "findings": [
        {
          "id": "f1",
          "category": "clarity",
          "severity": "low",
          "title": "Minor wording",
          "description": "Could be tighter.",
          "recommendation": "Tighten phrasing."
        }
      ]
    }
  ],
  "findings": [
    {
      "id": "f1",
      "category": "clarity",
      "severity": "low",
      "title": "Minor wording",
      "description": "Could be tighter.",
      "recommendation": "Tighten phrasing."
    }
  ],
  "passCriteria": {
    "minCategoriesPassing": "all_required",
    "maxFindingsSeverity": {
      "critical": 0,
      "high": 0,
      "medium": -1,
      "low": -1
    }
  },
  "decision": {
    "status": "conditional",
    "passed": true,
    "rationale": "Passed with non-blocking findings",
    "findingCounts": {
      "critical": 0,
      "high": 0,
      "medium": 0,
      "low": 1,
      "info": 0,
      "total": 1
    },
    "categoryCounts": {
      "pass": 1,
      "partial": 0,
      "fail": 0,
      "total": 1
    }
  },
  "overallDecision": "conditional",
  "nextSteps": {
    "rerunCommand": "pdlc check"
  },
  "summary": "Categories: 1 pass, 0 partial, 0 fail. 1 findings (1 low). Decision: conditional."
}
